{
  "schema_version": 1,
  "id": "kv260_frontier_v0_1",
  "title": "KV260 frontier-model agentic workflow regression",
  "model_policy": "frontier-inherited",
  "target": {
    "board": "AMD Kria KV260 Vision AI Starter Kit",
    "board_part": "xilinx.com:kv260_som:part0:1.4",
    "part": "xck26-sfvc784-2LV-c",
    "vivado_version": "2025.2"
  },
  "acceptance": {
    "require_contracts": true,
    "require_independent_simulation": true,
    "require_vivado_signoff": true,
    "require_programming_image": true
  },
  "cases": [
    {"rank": 1, "case_id": "kv260_pl_counter", "level": "foundation", "focus": "Counter control, priority, terminal pulse, and first PS/PL integration"},
    {"rank": 2, "case_id": "kv260_pwm_generator", "level": "foundation", "focus": "Parameterized timing and boundary duty-cycle behavior"},
    {"rank": 3, "case_id": "kv260_debounce_counter", "level": "foundation", "focus": "Input qualification, edge detection, and stateful counting"},
    {"rank": 4, "case_id": "kv260_watchdog_irq", "level": "foundation", "focus": "Reload semantics, one-cycle interrupt, and sticky status"},
    {"rank": 5, "case_id": "kv260_axi_lite_regs", "level": "foundation", "focus": "AXI4-Lite protocol, byte enables, and software-visible registers"},
    {"rank": 6, "case_id": "kv260_axis_register_slice", "level": "foundation", "focus": "AXI4-Stream valid/ready elasticity and backpressure"},
    {"rank": 7, "case_id": "kv260_sync_fifo", "level": "intermediate", "focus": "FIFO ordering, simultaneous operations, flags, and occupancy"},
    {"rank": 8, "case_id": "kv260_crc32_stream", "level": "intermediate", "focus": "Framed streaming CRC state and result timing"},
    {"rank": 9, "case_id": "kv260_fir_filter", "level": "intermediate", "focus": "Signed fixed-point arithmetic and pipelined filtering"},
    {"rank": 10, "case_id": "kv260_async_fifo", "level": "intermediate", "focus": "Dual-clock CDC, Gray pointers, and independent reset behavior"},
    {"rank": 11, "case_id": "kv260_axis_packetizer", "level": "intermediate", "focus": "Packet boundaries and arbitrary downstream backpressure"},
    {"rank": 12, "case_id": "kv260_bram_scratchpad", "level": "intermediate", "focus": "Dual-port memory, byte writes, and collision semantics"},
    {"rank": 13, "case_id": "kv260_dma_loopback", "level": "advanced", "focus": "AXI DMA integration and packet-safe streaming transformation"},
    {"rank": 14, "case_id": "kv260_sobel_filter", "level": "advanced", "focus": "Neighborhood image processing and deterministic border handling"},
    {"rank": 15, "case_id": "kv260_rgb_to_grayscale", "level": "advanced", "focus": "Video stream sidebands and BT.601 fixed-point conversion"},
    {"rank": 16, "case_id": "kv260_video_test_pattern", "level": "advanced", "focus": "Frame/line timing, color bars, and video backpressure"},
    {"rank": 17, "case_id": "kv260_frame_buffer_path", "level": "advanced", "focus": "DDR frame-buffer packing, unpacking, and sideband preservation"},
    {"rank": 18, "case_id": "kv260_video_scaler", "level": "advanced", "focus": "Stateful 2x downscaling under streaming flow control"},
    {"rank": 19, "case_id": "kv260_mipi_capture_pipeline", "level": "system", "focus": "MIPI CSI-2 capture integration and Bayer preprocessing"},
    {"rank": 20, "case_id": "kv260_vision_pipeline", "level": "system", "focus": "End-to-end MIPI, vision kernel, DDR, and display integration"},
    {"rank": 21, "case_id": "kv260_i2s_transmitter", "level": "advanced", "focus": "I2S serialization, channel framing, and backpressure-safe audio delivery"},
    {"rank": 22, "case_id": "kv260_i2s_receiver", "level": "advanced", "focus": "I2S capture, word alignment, and stereo channel reconstruction"},
    {"rank": 23, "case_id": "kv260_audio_gain", "level": "advanced", "focus": "Runtime gain control with signed fixed-point saturation"},
    {"rank": 24, "case_id": "kv260_stereo_mixer", "level": "advanced", "focus": "Multi-source stereo mixing, rounding, and output saturation"},
    {"rank": 25, "case_id": "kv260_audio_tone_generator", "level": "advanced", "focus": "Deterministic phase accumulation and stereo audio stimulus"},
    {"rank": 26, "case_id": "kv260_audio_fir_equalizer", "level": "advanced", "focus": "Pipelined signed audio filtering and coefficient-controlled equalization"},
    {"rank": 27, "case_id": "kv260_audio_peak_meter", "level": "advanced", "focus": "Windowed audio magnitude measurement and channel peak reporting"},
    {"rank": 28, "case_id": "kv260_audio_mute_ramp", "level": "advanced", "focus": "Click-free mute transitions with bounded gain ramping"},
    {"rank": 29, "case_id": "kv260_audio_channel_router", "level": "advanced", "focus": "Runtime stereo routing, duplication, muting, and channel swap"},
    {"rank": 30, "case_id": "kv260_audio_dc_blocker", "level": "advanced", "focus": "Stateful fixed-point high-pass filtering and reset recovery"},
    {"rank": 31, "case_id": "kv260_raw10_unpacker", "level": "advanced", "focus": "MIPI RAW10 packed sensor-pixel conversion and stream preservation"},
    {"rank": 32, "case_id": "kv260_bayer_demosaic", "level": "advanced", "focus": "Bayer neighborhood interpolation across all center-pixel phases"},
    {"rank": 33, "case_id": "kv260_color_correction", "level": "advanced", "focus": "Signed fixed-point RGB color-matrix arithmetic and saturation"},
    {"rank": 34, "case_id": "kv260_gamma_lut", "level": "advanced", "focus": "Deterministic lookup transformation and full-range pixel mapping"},
    {"rank": 35, "case_id": "kv260_image_histogram", "level": "advanced", "focus": "Streaming frame histogram accumulation and memory updates"},
    {"rank": 36, "case_id": "kv260_adaptive_threshold", "level": "advanced", "focus": "Runtime-controlled local-mean segmentation and boundary arithmetic"},
    {"rank": 37, "case_id": "kv260_morphology_3x3", "level": "advanced", "focus": "Packed-neighborhood binary erosion and dilation"},
    {"rank": 38, "case_id": "kv260_object_bounding_box", "level": "advanced", "focus": "Frame-level foreground reduction into inclusive spatial bounds"},
    {"rank": 39, "case_id": "kv260_alpha_overlay", "level": "advanced", "focus": "Per-pixel alpha composition, rounding, and dual-image alignment"},
    {"rank": 40, "case_id": "kv260_video_cropper", "level": "advanced", "focus": "Coordinate-aware raster cropping and regenerated video sidebands"},
    {"rank": 41, "case_id": "kv260_motion_detector", "level": "advanced", "focus": "Temporal frame differencing, thresholds, and motion reduction"},
    {"rank": 42, "case_id": "kv260_frame_statistics", "level": "advanced", "focus": "Frame minimum, maximum, sum, and mean accumulation"},
    {"rank": 43, "case_id": "kv260_av_timestamp", "level": "system", "focus": "Cross-stream audio/video timestamp correlation and epoch handling"},
    {"rank": 44, "case_id": "kv260_axi_traffic_monitor", "level": "system", "focus": "AXI performance instrumentation, counters, and bounded observation windows"},
    {"rank": 45, "case_id": "kv260_interrupt_aggregator", "level": "system", "focus": "PS-visible event aggregation, prioritization, masking, and acknowledgement"},
    {"rank": 46, "case_id": "kv260_dma_descriptor_queue", "level": "system", "focus": "DMA descriptor admission, ordering, issue, and completion accounting"},
    {"rank": 47, "case_id": "kv260_ddr_bandwidth_exerciser", "level": "system", "focus": "Bounded DDR traffic generation and throughput/error measurement"},
    {"rank": 48, "case_id": "kv260_linux_gpio_mailbox", "level": "system", "focus": "Linux-visible PS-to-PL command, response, and GPIO mailbox protocol"},
    {"rank": 49, "case_id": "kv260_camera_audio_synchronizer", "level": "system", "focus": "Camera/audio epoch alignment, skew measurement, and resynchronization"},
    {"rank": 50, "case_id": "kv260_multimedia_appliance", "level": "system", "focus": "End-to-end camera, audio, DDR, PS software, interrupt, and debug integration"}
  ]
}
